{
  "name": "Quiet Dip Buyer",
  "thesis": "Buy oversold dips below the lower Bollinger band while the long-term trend is up; take quick profits.",
  "universe": ["BTC/USDT", "ETH/USDT"],
  "timeframe": "1h",
  "entry": {"all": [
    {"left": {"ind": "rsi", "period": 14}, "op": "<", "right": 32},
    {"left": {"ind": "close"}, "op": "<", "right": {"ind": "bb_lower", "period": 20, "std": 2.0}},
    {"left": {"ind": "close"}, "op": ">", "right": {"ind": "sma", "period": 200, "mult": 0.97}}
  ]},
  "exit": {"take_profit_pct": 3, "stop_loss_pct": 2.5, "max_hold_bars": 48},
  "sizing": {"position_pct": 40, "max_positions": 2}
}
